{
  "event_type": "mission_notification_state_update",
  "schema_version": "1.0.0",
  "mission_id": "example-mission",
  "state": "waiting_approval",
  "severity": "attention",
  "reason": "The mission requires human approval before continuing.",
  "required_human_action": "Review the Hokage plan proposal and approve or reject the transition.",
  "actor": "konoha",
  "created_at": "2026-07-08T00:00:00+00:00",
  "boundaries": {
    "execution": "blocked",
    "repository_apply": "blocked",
    "git_operations": "blocked",
    "private_context_access": "blocked",
    "real_model_invocation": "blocked",
    "network_access": "blocked",
    "background_agents": "blocked"
  }
}